{
  "difficulty_tier": 2,
  "family": "canb-poly",
  "id": "canb-poly-n167",
  "known_closed_form": null,
  "notes": "non-Gauss-Wantzel n=167",
  "reference_value": "0.9992923059121103266579655058854088452825842729053686596030533505547156056676484518252726059171611772033931450977509476589574699511929208370534946482914381903494464963038412443622132087252631283569932390358865149781772238520167290908456187328536099545998588254149235773539406692884517315073837393794257061280966796593126909407688754863556257340774266617830619564256536600222466497626672185959858024632652257007586263152229618551827435990295780435696631123480554153337314494215177917647878838245285058022860387027905506560694888854293259237052830257426136949223752738588772269686915512584105035913338798080252468317819988587446804449336544486101780222700584752987592698783179312382763010330709159832637791032225104027077223286904272091453100348730845931065071267002398753783257658858294930457337171455195645015648446835678145456542052195155484801960083518542733934147105310726685263892152167236876812141989587862060072135947447380862201314871515345417667720734235879557764107253678352933781560031336507",
  "reference_value_dps": 1000,
  "target_description": "cos(2*pi/167)",
  "target_spec": {
    "arg": [
      2,
      167
    ],
    "kind": "cos_of_rational_pi"
  }
}
