{
  "difficulty_tier": 2,
  "family": "canb-trig",
  "id": "canb-trig-tan-p2-q11",
  "known_closed_form": null,
  "notes": "reduced rational angle with non-Gauss-Wantzel q=11",
  "reference_value": "0.6426609771683310803894354144361884655789889422055131542957796335780048202923725477089259602251357634803384431847451118097738815898205342890304174687099624426970689978548473326254178235368477957781967647656918306149300631327468962003620827433753367535702916575010686722686951885770343147094010974653111138850947926608542779856293278311729192882652659383605819785241544140373781315965588531933140104896558718628186530189804423389507148199137083937140449419608443869838354681290291205891708367174845697827692189067681669715027088898567085606419067160906125983474209484614658584851256087594690675371146729391946187823780317668826909094582399857969248963207627116078735682234254560010525157976441143859725753335048296418260827840717905405944202005308328148589350437376673345801899465752379381816898205861224722865975496383492742589751166815068898147774006992501518709158987452441507535200764631288196423139147791278028372486701255540501631100216981864869054154025438421587796043561713334906285318027689121",
  "reference_value_dps": 1000,
  "target_description": "tan(2*pi/11)",
  "target_spec": {
    "arg": [
      2,
      11
    ],
    "kind": "tan_of_rational_pi"
  }
}
