{
  "difficulty_tier": 2,
  "family": "canb-trig",
  "id": "canb-trig-sin-p5-q7",
  "known_closed_form": null,
  "notes": "reduced rational angle with non-Gauss-Wantzel q=7",
  "reference_value": "0.7818314824680298087084445266740577502323345187086875289806349580450917316339364417008680068909909822322615791605380144722392570457257455045865319329248423263536573359042016905926073391167676403772644808334383499476193468626250885070080952148445333966155510232390288966763592080879300694682398785705325829032405334114595433611113110278530136688297417510914953509384609075181238348834136483413940807776075181647643430436715445761111419272664691681937574665420852521806722248683694648147108539120395857008934315826093783338444989986509473197469145597152093975004428093238245358704724747102829348250803944073358786621375187916464505023180666542139773055207931696711097970080305728643352045780067565549307247823275240830876868269911337554594413300989768798432750650900533406144345596592104015521387875724681584197722652635646755721007218615665892440862479476013828406350306062824194507057263132484690801519110520127453947182619928502985006038611931009665344300267025825261970632647772376727881178262632099",
  "reference_value_dps": 1000,
  "target_description": "sin(5*pi/7)",
  "target_spec": {
    "arg": [
      5,
      7
    ],
    "kind": "sin_of_rational_pi"
  }
}
