{
  "difficulty_tier": 4,
  "family": "canb-transcend",
  "id": "canb-transcend-euler-gamma",
  "known_closed_form": null,
  "notes": "transcendental/control target",
  "reference_value": "0.5772156649015328606065120900824024310421593359399235988057672348848677267776646709369470632917467495146314472498070824809605040144865428362241739976449235362535003337429373377376739427925952582470949160087352039481656708532331517766115286211995015079847937450857057400299213547861466940296043254215190587755352673313992540129674205137541395491116851028079842348775872050384310939973613725530608893312676001724795378367592713515772261027349291394079843010341777177808815495706610750101619166334015227893586796549725203621287922655595366962817638879272680132431010476505963703947394957638906572967929601009015125195950922243501409349871228247949747195646976318506676129063811051824197444867836380861749455169892792301877391072945781554316005002182844096053772434203285478367015177394398700302370339518328690001558193988042707411542227819716523011073565833967348717650491941812300040654693142999297779569303100503086303418569803231083691640025892970890985486825777364288253954925873629596133298574739302",
  "reference_value_dps": 1000,
  "target_description": "Euler-Mascheroni gamma",
  "target_spec": {
    "kind": "literal_transcendental",
    "name": "euler_gamma"
  }
}
